{
  "id": "bitwarden-secrets",
  "name": "Bitwarden Secrets Integration",
  "author": "DeskStride",
  "description": "Read secrets from Bitwarden vault via CLI. Securely access logins, secure notes, and other vault items in workflows.",
  "category": "security",
  "latestVersion": "1.0.1",
  "downloadUrl": "https://raw.githubusercontent.com/zelucode/deskstride-extensions-packaged/main/bitwarden-secrets/bitwarden-secrets-1.0.1.dsext",
  "sha256": "97a8c2dbcdda614d625206972ef2c181b8223a1d021c77c92ab4c93b2f210bb1",
  "sigUrl": "https://raw.githubusercontent.com/zelucode/deskstride-extensions-packaged/main/bitwarden-secrets/bitwarden-secrets-1.0.1.dsext.sig",
  "permissions": [
    "shell",
    "secrets"
  ],
  "authorProfile": "https://github.com/zelucode",
  "verified": true,
  "revoked": false,
  "revokedReason": null
}
