{
  "id": "acme-pdf-tools",
  "name": "Acme PDF Tools",
  "author": "Automation OS",
  "authorProfile": "https://github.com/zelucode",
  "description": "Merge and split PDF files -- worked example (sibling helpers, private deps/, settings, a PDF Inspector page).",
  "homepage": "https://github.com/zelucode/pdf-tools-extension",
  "category": "documents",
  "latestVersion": "1.2.0",
  "minAppVersion": "0.9.0",
  "downloadUrl": "https://github.com/zelucode/pdf-tools-extension/releases/download/v1.2.0/pdf-tools.aosext",
  "sigUrl": "https://github.com/zelucode/pdf-tools-extension/releases/download/v1.2.0/pdf-tools.aosext.sig",
  "sha256": "d2b87e378f31af3e0210b1c847cccc81911ff81a46dbbaab4ff8f16568c1df82",
  "verified": true,
  "revoked": false,
  "revokedReason": null
}
