{
  "id": "webhook-notifier",
  "name": "Webhook Notifier",
  "author": "DeskStride",
  "description": "Sends a workflow event to a configured webhook URL, with an optional self-test receiver route -- a worked example of Phase 3 settings (incl. secrets) and HTTP routes.",
  "category": "integrations",
  "latestVersion": "1.0.1",
  "downloadUrl": "https://raw.githubusercontent.com/zelucode/deskstride-extensions-packaged/main/webhook-notifier/webhook-notifier-1.0.1.dsext",
  "sha256": "48309478f3a38527d6dc564e274a2d8538255aafd97abeaf8a2cb0613602c328",
  "sigUrl": "https://raw.githubusercontent.com/zelucode/deskstride-extensions-packaged/main/webhook-notifier/webhook-notifier-1.0.1.dsext.sig",
  "permissions": [
    "network",
    "secrets",
    "httpRoutes"
  ],
  "authorProfile": "https://github.com/zelucode",
  "verified": true,
  "revoked": false,
  "revokedReason": null
}
