{
  "id": "cloud-storage-bridge",
  "name": "Cloud Storage Bridge",
  "author": "DeskStride",
  "description": "Upload, download, list, share, and create folders on Google Drive, OneDrive, or Dropbox. REQUIRES the 'oauth-handler' extension \u2014 pipe accessToken from its OAuth Get Token node into any Cloud Storage Bridge node.",
  "category": "integrations",
  "latestVersion": "1.0.2",
  "downloadUrl": "https://raw.githubusercontent.com/zelucode/deskstride-extensions-packaged/main/cloud-storage-bridge/cloud-storage-bridge-1.0.2.dsext",
  "sha256": "e05c125a67417801b0b0431434048545d03c6f43b3ca2c2c306a1738079274df",
  "sigUrl": "https://raw.githubusercontent.com/zelucode/deskstride-extensions-packaged/main/cloud-storage-bridge/cloud-storage-bridge-1.0.2.dsext.sig",
  "permissions": [
    "network",
    "filesystem",
    "secrets"
  ],
  "authorProfile": "https://github.com/zelucode",
  "verified": true,
  "revoked": false,
  "revokedReason": null
}
