{
  "id": "acme-qr-code-tools",
  "name": "Acme QR Code Tools",
  "author": "DeskStride",
  "description": "Generate a QR code PNG from text, or decode an existing QR code image back to text.",
  "category": "utilities",
  "latestVersion": "1.0.1",
  "downloadUrl": "https://raw.githubusercontent.com/zelucode/deskstride-extensions-packaged/main/acme-qr-code-tools/acme-qr-code-tools-1.0.1.dsext",
  "sha256": "fb072929cffa2f55d8445611ef06c94b66fcb52edadcc67b97802e40fe562181",
  "sigUrl": "https://raw.githubusercontent.com/zelucode/deskstride-extensions-packaged/main/acme-qr-code-tools/acme-qr-code-tools-1.0.1.dsext.sig",
  "permissions": [
    "filesystem",
    "shell"
  ],
  "authorProfile": "https://github.com/zelucode",
  "verified": true,
  "revoked": false,
  "revokedReason": null
}
